sku,name,category_id,description,unit,cost_price,selling_price,quantity_in_stock,minimum_stock_level,maximum_stock_level,reorder_point,reorder_quantity,location,brand,model,warranty_period,is_serialized,created_by
ELEC028,Rode PodMic USB,1,Rode PodMic USB Broadcast Microphone,pcs,149.00,199.00,32,15,60,20,30,C1-08,Rode,PodMic USB,24,FALSE,1
ELEC029,Yamaha HS5 Studio Monitor,1,Yamaha HS5 Active Studio Monitor,pcs,169.00,229.00,24,10,40,15,20,C1-09,Yamaha,HS5,36,FALSE,1
ELEC030,Focusrite Scarlett Solo,1,Focusrite Scarlett Solo Audio Interface,pcs,89.00,129.00,38,18,70,22,32,C1-10,Focusrite,Scarlett Solo,24,FALSE,1
ELEC031,Logitech MX Master 3S,1,Logitech MX Master 3S Wireless Mouse,pcs,79.00,109.00,95,40,180,50,70,D1-01,Logitech,MX Master 3S,24,FALSE,1
ELEC032,Apple Magic Keyboard,1,Apple Magic Keyboard with Touch ID,pcs,149.00,199.00,65,25,120,35,50,D1-02,Apple,Magic Keyboard,12,FALSE,1
ELEC033,Corsair K95 RGB Platinum,1,Corsair K95 RGB Platinum Mechanical Keyboard,pcs,159.00,219.00,42,18,80,25,35,D1-03,Corsair,K95 RGB Platinum,24,FALSE,1
ELEC034,Razer DeathAdder V3,1,Razer DeathAdder V3 Gaming Mouse,pcs,69.00,99.00,88,35,150,45,65,D1-04,Razer,DeathAdder V3,24,FALSE,1
ELEC035,SteelSeries Apex Pro,1,SteelSeries Apex Pro Mechanical Gaming Keyboard,pcs,179.00,249.00,28,12,50,18,25,D1-05,SteelSeries,Apex Pro,24,FALSE,1
ELEC036,Logitech C920 HD Pro,1,Logitech C920 HD Pro Webcam,pcs,59.00,89.00,110,50,200,65,85,D1-06,Logitech,C920 HD Pro,24,FALSE,1
ELEC037,Microsoft Surface Pen,1,Microsoft Surface Pen Digital Stylus,pcs,79.00,109.00,72,30,120,40,55,D1-07,Microsoft,Surface Pen,12,FALSE,1
ELEC038,Elgato Stream Deck,1,Elgato Stream Deck MK.2 for streamers,pcs,149.00,199.00,40,15,70,20,30,D1-08,Elgato,Stream Deck MK.2,24,FALSE,1
ELEC039,HyperX Cloud II Headset,1,HyperX Cloud II Gaming Head       